{
  "$schema": "../../../../config/deal-schema.json",
  "dealId": "va-missing-phase1",
  "dealName": "Cedar Industrial Lofts",
  "property": {
    "address": "240 Cedar Industrial Blvd",
    "city": "Cleveland",
    "state": "OH",
    "zip": "44113",
    "county": "Cuyahoga",
    "propertyType": "multifamily",
    "yearBuilt": 1996,
    "totalUnits": 128,
    "totalSqFt": 110600,
    "avgUnitSqFt": 864,
    "unitMix": {
      "types": [
        {
          "type": "1BR/1BA",
          "count": 58,
          "avgSqFt": 700,
          "marketRent": 1520,
          "inPlaceRent": 1410
        },
        {
          "type": "2BR/2BA",
          "count": 70,
          "avgSqFt": 1000,
          "marketRent": 1950,
          "inPlaceRent": 1830
        }
      ]
    }
  },
  "financials": {
    "askingPrice": 15800000,
    "pricePerUnit": 123438,
    "currentNOI": 943000,
    "inPlaceOccupancy": 0.8984,
    "trailingT12Revenue": 2040000,
    "trailingT12Expenses": 1097000,
    "estimatedClosingCosts": 474000,
    "proFormaNOI": 1180000,
    "marketOccupancy": 0.93,
    "renovationBudget": 1300000
  },
  "financing": {
    "targetLTV": 0.7,
    "estimatedRate": 0.063,
    "loanTerm": 10,
    "amortization": 30,
    "loanType": "Bank",
    "interestOnly": false,
    "ioPeriod": 0
  },
  "investmentStrategy": "value-add",
  "targetHoldPeriod": 5,
  "targetIRR": 0.16,
  "targetEquityMultiple": 1.85,
  "targetCashOnCash": 0.06,
  "seller": {
    "name": "J. Brandt",
    "entity": "Cedar Industrial Lofts LLC",
    "broker": "A. Kowalski",
    "brokerFirm": "Lakefront Commercial Group"
  },
  "timeline": {
    "psaExecutionDate": "2026-03-09",
    "ddStartDate": "2026-03-10",
    "ddExpirationDate": "2026-04-09",
    "closingDate": "2026-05-11"
  },
  "notes": "Value-add adaptive reuse missing a Phase I ESA, with an OM NOI that overstates the T12."
}
